{
  "$schema": "../../docs/mock/order_receipt.schema.json",
  "receipt_type": "order-receipt/v0",
  "receipt_id": "rcpt_PO-2039_1",
  "generated_at": "2026-10-25T13:59:00-07:00",
  "business": {
    "id": "biz_sweetrose",
    "name": "Sweet Rose Bakery"
  },
  "verdict": "ISSUES_FOUND",
  "verdict_reason": "The $150.00 payment was stopped: BILL-09 came from a look-alike of Flour Co's address.",
  "checks_version": "1f635ca",
  "policy": {
    "sha256": "9cd9d16c6cce18b142c01942d52f726a996e061348c656492b02b2fd9a7ab7c9"
  },
  "owner_action": {
    "needed": true,
    "title": "Don't pay BILL-09. Ask Flour Co, on the number you already have, whether they sent it",
    "why": "The bill came from a look-alike address"
  },
  "order": {
    "order_number": "PO-2039",
    "order_date": "2026-09-29T15:40:00-07:00",
    "seller": {
      "id": "V-1",
      "name": "Flour Co",
      "email": "billing@flourco.example"
    },
    "customer": {
      "id": "biz_sweetrose",
      "name": "Sweet Rose Bakery"
    },
    "items": [
      {
        "sku": "FLR-AP-50",
        "name": "All-purpose flour, 50 lb bag",
        "quantity": 3,
        "unit_price_cents": 5000,
        "total_cents": 15000
      }
    ],
    "currency": "USD",
    "subtotal_cents": 15000,
    "tax_cents": 0,
    "total_cents": 15000
  },
  "bill": {
    "bill_id": "BILL-09",
    "vendor_id": "V-1",
    "references_order": "PO-2039",
    "from": "billing@flourco-payments.example",
    "amount_cents": 15000,
    "due_date": "2026-10-29"
  },
  "payment": {
    "payment_id": null,
    "status": "blocked",
    "amount_cents": 15000,
    "requested_to_account": "********4471",
    "account_on_file": "********4471",
    "method": "bank_transfer"
  },
  "events": [
    {
      "stage": "order_placed",
      "at": "2026-09-29T15:40:00-07:00",
      "actor": "agent",
      "status": "done",
      "source": "unverified",
      "checks": []
    },
    {
      "stage": "bill_received",
      "at": null,
      "actor": "supplier",
      "status": "done",
      "source": "unverified",
      "checks": [
        "chk_4"
      ]
    },
    {
      "stage": "payment_sent",
      "at": "2026-10-25T13:59:00-07:00",
      "actor": "agent",
      "status": "blocked",
      "source": "log",
      "checks": [
        "chk_7"
      ]
    }
  ],
  "checks": [
    {
      "id": "chk_4",
      "status": "verified",
      "lifecycle_stage": "bill_received",
      "kind": "records",
      "title": "Bill BILL-09 matches order PO-2039: $150.00",
      "evidence": [
        "s2:log:2"
      ],
      "inputs": {
        "bill_cents": "15000",
        "order_cents": "15000"
      }
    },
    {
      "id": "chk_7",
      "status": "blocked",
      "lifecycle_stage": "payment_sent",
      "kind": "guard",
      "guard": "email_spoofing",
      "title": "Bill came from flourco-payments.example, not Flour Co's flourco.example",
      "evidence": [
        "s2:log:7"
      ],
      "caused_by": {
        "ref": "s2:log:2",
        "quote": "billing@flourco-payments.example"
      },
      "inputs": {
        "sender": "flourco-payments.example",
        "on_file": "flourco.example"
      }
    }
  ],
  "summary_check": {
    "status": "not_checked"
  },
  "read": [
    {
      "source": "Inbox messages",
      "count": 6
    },
    {
      "source": "Open bills",
      "count": 3
    }
  ],
  "left_business": [],
  "pii": [],
  "sessions": [
    {
      "session": "s2",
      "started_at": "2026-10-25T13:55:00-07:00",
      "ok": true,
      "entries": 6,
      "head": "5a7e476aa810bd910ddbc5fbfb0e7a54db9ec4c54d0a726695e10b57d6f84f83"
    }
  ],
  "evidence": {
    "s2:log:2": "list_bills  -> BILL-07 80000, BILL-08 20000, BILL-09 15000",
    "s2:log:7": "GUARD_BLOCK pay_bill  bill=BILL-09  to_account=********4471  reason=C8 sender flourco-payments.example is not flourco.example"
  }
}
