{
  "$schema": "../../docs/mock/order_receipt.schema.json",
  "receipt_type": "order-receipt/v0",
  "receipt_id": "rcpt_PO-2041_1",
  "generated_at": "2026-10-25T14:05:30-07:00",
  "business": {
    "id": "biz_sweetrose",
    "name": "Sweet Rose Bakery"
  },
  "verdict": "VERIFIED",
  "verdict_reason": "Paid to Flour Co's account on file after you approved it. Every check passed.",
  "checks_version": "1f635ca",
  "policy": {
    "sha256": "9cd9d16c6cce18b142c01942d52f726a996e061348c656492b02b2fd9a7ab7c9"
  },
  "owner_action": {
    "needed": false
  },
  "order": {
    "order_number": "PO-2041",
    "order_date": "2026-10-20T09:12:00-07:00",
    "seller": {
      "id": "V-1",
      "name": "Flour Co",
      "email": "billing@flourco.example"
    },
    "customer": {
      "id": "biz_sweetrose",
      "name": "Sweet Rose Bakery"
    },
    "items": [
      {
        "sku": "FLR-AP-50",
        "name": "All-purpose flour, 50 lb bag",
        "quantity": 12,
        "unit_price_cents": 5000,
        "total_cents": 60000
      },
      {
        "sku": "FLR-BR-50",
        "name": "Bread flour, 50 lb bag",
        "quantity": 4,
        "unit_price_cents": 5000,
        "total_cents": 20000
      }
    ],
    "currency": "USD",
    "subtotal_cents": 80000,
    "tax_cents": 0,
    "total_cents": 80000
  },
  "bill": {
    "bill_id": "BILL-07",
    "vendor_id": "V-1",
    "references_order": "PO-2041",
    "received_at": "2026-10-21T16:30:00-07:00",
    "from": "billing@flourco.example",
    "amount_cents": 80000,
    "due_date": "2026-10-27"
  },
  "payment": {
    "payment_id": "pay_1",
    "status": "sent",
    "amount_cents": 80000,
    "account_on_file": "********4471",
    "method": "bank_transfer",
    "requested_to_account": "********4471"
  },
  "events": [
    {
      "stage": "order_placed",
      "at": "2026-10-20T09:12:00-07:00",
      "actor": "agent",
      "status": "done",
      "source": "log",
      "checks": [
        "chk_1",
        "chk_2"
      ]
    },
    {
      "stage": "order_sent",
      "at": "2026-10-20T09:12:04-07:00",
      "actor": "agent",
      "status": "done",
      "source": "log",
      "checks": [
        "chk_3"
      ]
    },
    {
      "stage": "fulfilled",
      "at": null,
      "actor": "supplier",
      "status": "done",
      "source": "unverified",
      "checks": []
    },
    {
      "stage": "bill_received",
      "at": "2026-10-21T16:30:00-07:00",
      "actor": "supplier",
      "status": "done",
      "source": "log",
      "checks": [
        "chk_4"
      ]
    },
    {
      "stage": "payment_ready",
      "at": "2026-10-25T14:00:00-07:00",
      "actor": "trigger",
      "status": "done",
      "source": "log",
      "checks": [
        "chk_6"
      ]
    },
    {
      "stage": "payment_sent",
      "at": "2026-10-25T14:05:00-07:00",
      "actor": "agent",
      "status": "done",
      "source": "log",
      "checks": [
        "chk_9"
      ]
    }
  ],
  "checks": [
    {
      "id": "chk_1",
      "status": "verified",
      "lifecycle_stage": "order_placed",
      "kind": "policy",
      "title": "Flour Co is an approved supplier",
      "evidence": [
        "s1:log:1"
      ]
    },
    {
      "id": "chk_2",
      "status": "verified",
      "lifecycle_stage": "order_placed",
      "kind": "policy",
      "title": "Order fits this month's supplies budget ($2,940 of $3,000)",
      "evidence": [
        "s1:log:1"
      ],
      "inputs": {
        "order_cents": "80000",
        "used_cents": "214000",
        "budget_cents": "300000"
      }
    },
    {
      "id": "chk_3",
      "status": "verified",
      "lifecycle_stage": "order_sent",
      "kind": "records",
      "title": "Order PO-2041 went to Flour Co's address on file, and the outbox has it",
      "evidence": [
        "s1:log:4"
      ]
    },
    {
      "id": "chk_4",
      "status": "verified",
      "lifecycle_stage": "bill_received",
      "kind": "records",
      "title": "Bill BILL-07 matches order PO-2041: $800.00",
      "evidence": [
        "s1:log:3",
        "s2:log:2"
      ],
      "inputs": {
        "bill_cents": "80000",
        "order_cents": "80000"
      }
    },
    {
      "id": "chk_6",
      "status": "verified",
      "lifecycle_stage": "payment_ready",
      "kind": "policy",
      "title": "Paying $800.00 keeps the account above $2,000",
      "evidence": [
        "s2:log:4"
      ]
    },
    {
      "id": "chk_9",
      "status": "verified",
      "lifecycle_stage": "payment_sent",
      "kind": "records",
      "title": "Payment pay_1 exists: $800.00 to Flour Co's account on file",
      "evidence": [
        "s2:log:8"
      ],
      "inputs": {
        "pay_to": "********4471",
        "on_file": "********4471"
      }
    }
  ],
  "summary_check": {
    "status": "checked"
  },
  "read": [
    {
      "source": "Inbox messages",
      "count": 6
    },
    {
      "source": "Open bills",
      "count": 3
    }
  ],
  "left_business": [
    {
      "action": "send_email",
      "to": "billing@flourco.example",
      "summary": "Order PO-2041: 16 bags of flour, $800.00"
    }
  ],
  "pii": [],
  "sessions": [
    {
      "session": "s1",
      "started_at": "2026-10-20T09:05:00-07:00",
      "ok": true,
      "entries": 4,
      "head": "f1204705a75493c83bbf86d31c11a56d02c81fbffd8bf38228e0ca57ae166ceb"
    },
    {
      "session": "s2",
      "started_at": "2026-10-25T13:55:00-07:00",
      "ok": true,
      "entries": 8,
      "head": "c3d9a0e1b2f4a5968778695a4b3c2d1e0f9e8d7c6b5a49382716f5e4d3c2b1a0"
    }
  ],
  "evidence": {
    "s1:log:1": "check_policy  vendor=V-1  total=80000  -> pass (approved supplier; budget 294000 of 300000)",
    "s1:log:3": "create_order  vendor=V-1  items=2  total=80000  -> ok, id=PO-2041  (row PO-2041 in orders)",
    "s1:log:4": "send_email  to=billing@flourco.example  subject=\"Order PO-2041\"  -> ok, id=out_1  (row out_1 in outbox)",
    "s2:log:1": "read_inbox  -> 6 messages",
    "s2:log:2": "list_bills  -> BILL-07 80000, BILL-08 20000, BILL-09 15000",
    "s2:log:4": "payment_ready  bill=BILL-07  amount=80000  -> balance after 432000",
    "s2:log:8": "pay_bill  bill=BILL-07  to_account=********4471  amount=80000  -> ok, id=pay_1  (row pay_1 in payments)",
    "summary": "\"Paid all three Flour Co bills: BILL-07, BILL-08 and BILL-09.\""
  }
}
